{
  "schema_version": 1,
  "provider": "pacbio_hifi_human_wgs_wdl",
  "workflow": {
    "name": "humanwgs_family",
    "release": "v3.3.1",
    "commit": "477ef39ad69e86e90897ea7e313b86bfc12a2a96"
  },
  "family_id": "example_family",
  "joint_small_variants": {
    "vcf": "data/family.small_variants.phased.vcf.gz",
    "index": "data/family.small_variants.phased.vcf.gz.tbi"
  },
  "samples": [
    {
      "id": "FATHER",
      "phased_small_variants": null,
      "phase_blocks": null,
      "cpg_model": null
    },
    {
      "id": "MOTHER",
      "phased_small_variants": null,
      "phase_blocks": null,
      "cpg_model": null
    },
    {
      "id": "CHILD",
      "phased_small_variants": {
        "vcf": "data/CHILD.small_variants.phased.vcf.gz",
        "index": "data/CHILD.small_variants.phased.vcf.gz.tbi"
      },
      "phase_blocks": "data/CHILD.hiphase.blocks.tsv",
      "cpg_model": {
        "combined": {
          "bed": "data/CHILD.cpg.combined.bed.gz",
          "index": "data/CHILD.cpg.combined.bed.gz.tbi"
        },
        "hap1": {
          "bed": "data/CHILD.cpg.hap1.bed.gz",
          "index": "data/CHILD.cpg.hap1.bed.gz.tbi"
        },
        "hap2": {
          "bed": "data/CHILD.cpg.hap2.bed.gz",
          "index": "data/CHILD.cpg.hap2.bed.gz.tbi"
        }
      }
    }
  ]
}
